{"durable_state":"LEASED_ACTIVE","fencing_token":3,"head_receipt_id":"sha256:1111111111111111111111111111111111111111111111111111111111111111","head_receipt_sha256":"sha256:2222222222222222222222222222222222222222222222222222222222222222","head_sequence":18,"lease_id":"sha256:5555555555555555555555555555555555555555555555555555555555555555","release_identity_id":"sha256:3d52af3a2bc6eb185a48465c8680d988a57f7fecf668313673ded1aaed3a59ab","renewal":{"expires_at":"2026-08-15T00:05:45Z","receipt_id":"sha256:1111111111111111111111111111111111111111111111111111111111111111","receipt_sha256":"sha256:2222222222222222222222222222222222222222222222222222222222222222","sequence":18},"schema":"dpone.release-controller-lease-renew-response.v1","schema_version":1,"status":"ACTIVE","tag":"v0.74.0"}